Question,Answer Tuple,Comparison,Compositional,Grammatical Errors,Named Entities,No Answer,Telegraphic,Temporal,Topic,Answer Type
what was president andrew jackson's parents names?,FALSE,FALSE,FALSE,FALSE,0,FALSE,FALSE,FALSE,,
highest point of the tour de france?,FALSE,FALSE,FALSE,FALSE,0,FALSE,FALSE,FALSE,,
what was george w bush's political career before he was president?,FALSE,FALSE,FALSE,FALSE,0,FALSE,FALSE,FALSE,,
what is the largest mountain chain on the world?,FALSE,FALSE,FALSE,FALSE,0,FALSE,FALSE,FALSE,,
what is rosemary clooney to george clooney?,FALSE,FALSE,FALSE,FALSE,0,FALSE,FALSE,FALSE,,
who is the first lady governor of maharashtra?,FALSE,FALSE,FALSE,FALSE,0,FALSE,FALSE,FALSE,,
who was the youngest son of joe jackson?,FALSE,FALSE,FALSE,FALSE,0,FALSE,FALSE,FALSE,,
what is the highest mountain in the swiss alp?,FALSE,FALSE,FALSE,FALSE,0,FALSE,FALSE,FALSE,,
what awards and honours did john steinbeck receive?,FALSE,FALSE,FALSE,FALSE,0,FALSE,FALSE,FALSE,,
what was singer buddy holly's hometown?,FALSE,FALSE,FALSE,FALSE,0,FALSE,FALSE,FALSE,,
what was chris benoit wife name?,FALSE,FALSE,FALSE,FALSE,0,FALSE,FALSE,FALSE,,
what planet has the second hottest temperature?,FALSE,FALSE,FALSE,FALSE,0,FALSE,FALSE,FALSE,,
when did bing crosby die in?,FALSE,FALSE,FALSE,FALSE,0,FALSE,FALSE,FALSE,,
what is one of the mountains in washington state?,FALSE,FALSE,FALSE,FALSE,0,FALSE,FALSE,FALSE,,
who was the 1 born in the jackson 5?,FALSE,FALSE,FALSE,FALSE,0,FALSE,FALSE,FALSE,,
who was the second indian women climbed mount everest?,FALSE,FALSE,FALSE,FALSE,0,FALSE,FALSE,FALSE,,
where did albert abraham michelson live?,FALSE,FALSE,FALSE,FALSE,0,FALSE,FALSE,FALSE,,
who was the first person who invented the phone?,FALSE,FALSE,FALSE,FALSE,0,FALSE,FALSE,FALSE,,
when did cristiano ronaldo last play for manchester?,FALSE,FALSE,FALSE,FALSE,0,FALSE,FALSE,FALSE,,
who was the first man ever to walk on earth?,FALSE,FALSE,FALSE,FALSE,0,FALSE,FALSE,FALSE,,
hatshepsut was a female?,FALSE,FALSE,FALSE,FALSE,0,FALSE,FALSE,FALSE,,
what is colombia next to?,FALSE,FALSE,FALSE,FALSE,0,FALSE,FALSE,FALSE,,
what kind of food turkey europe eats?,FALSE,FALSE,FALSE,FALSE,0,FALSE,FALSE,FALSE,,
what is the next movie that steven strait will play in?,FALSE,FALSE,FALSE,FALSE,0,TRUE,FALSE,FALSE,,
which is the largest ethnic group in nigeria today?,FALSE,FALSE,FALSE,FALSE,0,FALSE,FALSE,FALSE,,
what are dorothy hamill's parents names?,FALSE,FALSE,FALSE,FALSE,0,FALSE,FALSE,FALSE,,
where did larry bird coach?,FALSE,FALSE,FALSE,FALSE,0,FALSE,FALSE,FALSE,,
what city is located on the north saskatchewan river is the capital of the canadian province of alberta?,FALSE,FALSE,FALSE,FALSE,0,FALSE,FALSE,FALSE,,
when was the first melbourne cup ever held?,FALSE,FALSE,FALSE,FALSE,0,FALSE,FALSE,FALSE,,
prime minister in canada?,FALSE,FALSE,FALSE,FALSE,0,FALSE,FALSE,FALSE,,
first female athlete on wheatis box?,FALSE,FALSE,FALSE,FALSE,0,FALSE,FALSE,FALSE,,
who are the senators representing louisiana?,FALSE,FALSE,FALSE,FALSE,0,FALSE,FALSE,FALSE,,
who have played cricket for both the countries india and pakistan?,FALSE,FALSE,FALSE,FALSE,0,FALSE,FALSE,FALSE,,
when did charles darwin die and be born?,FALSE,FALSE,FALSE,FALSE,0,FALSE,FALSE,FALSE,,
what river forms missouri's eastern borders?,FALSE,FALSE,FALSE,FALSE,0,FALSE,FALSE,FALSE,,
what year was robert burns born?,FALSE,FALSE,FALSE,FALSE,0,FALSE,FALSE,FALSE,,
when ashley michelle tisdale was born?,FALSE,FALSE,FALSE,FALSE,0,FALSE,FALSE,FALSE,,
what war missions did england fight in world war 2?,FALSE,FALSE,FALSE,FALSE,0,FALSE,FALSE,FALSE,,
what year did president lincoln die?,FALSE,FALSE,FALSE,FALSE,0,FALSE,FALSE,FALSE,,
what southern canadian province shares the longest border with the us?,FALSE,FALSE,FALSE,FALSE,0,FALSE,FALSE,FALSE,,
when did us go to war on iraq?,FALSE,FALSE,FALSE,FALSE,0,FALSE,FALSE,FALSE,,
who was the president when the lousiana territory was purchased?,FALSE,FALSE,FALSE,FALSE,0,FALSE,FALSE,FALSE,,
who did chris perez marry after selena quintanilla died?,FALSE,FALSE,FALSE,FALSE,0,FALSE,FALSE,FALSE,,
what was the name of the city dr martin luther king killed in?,FALSE,FALSE,FALSE,FALSE,0,FALSE,FALSE,FALSE,,
name a president born in ohio?,FALSE,FALSE,FALSE,FALSE,0,FALSE,FALSE,FALSE,,
the biggest island in britain?,FALSE,FALSE,FALSE,FALSE,0,FALSE,FALSE,FALSE,,
who was president bill cliton's vice president?,FALSE,FALSE,FALSE,FALSE,0,FALSE,FALSE,FALSE,,
what age is justin bieber parents?,FALSE,FALSE,FALSE,FALSE,0,FALSE,FALSE,FALSE,,
what is greenland currency?,FALSE,FALSE,FALSE,FALSE,0,FALSE,FALSE,FALSE,,
what is wayne roones brother called?,FALSE,FALSE,FALSE,FALSE,0,FALSE,FALSE,FALSE,,
which narrow body of water goes through sicily and italy?,FALSE,FALSE,FALSE,FALSE,0,FALSE,FALSE,FALSE,,
when did henry s truman get married?,FALSE,FALSE,FALSE,FALSE,0,FALSE,FALSE,FALSE,,
zip code of sta rosa laguna?,FALSE,FALSE,FALSE,FALSE,0,FALSE,FALSE,FALSE,,
who is the first african american to win nobel prize?,FALSE,FALSE,FALSE,FALSE,0,FALSE,FALSE,FALSE,,
what is the slogan for north dakota?,FALSE,FALSE,FALSE,FALSE,0,FALSE,FALSE,FALSE,,
michael jackson and lisa marie married?,FALSE,FALSE,FALSE,FALSE,0,FALSE,FALSE,FALSE,,
largest cities in washington?,FALSE,FALSE,FALSE,FALSE,0,FALSE,FALSE,FALSE,,
what secondary school did alexandra burke go to?,FALSE,FALSE,FALSE,FALSE,0,FALSE,FALSE,FALSE,,
who won champion league most?,FALSE,FALSE,FALSE,FALSE,0,FALSE,FALSE,FALSE,,
who plays jake ryan in hannah montana?,FALSE,FALSE,FALSE,FALSE,0,FALSE,FALSE,FALSE,,
what is the name of barbara windsors eastenders character?,FALSE,FALSE,FALSE,FALSE,0,FALSE,FALSE,FALSE,,
what is michael jackson's oldest son name?,FALSE,FALSE,FALSE,FALSE,0,FALSE,FALSE,FALSE,,
where is the highest point in st lucia?,FALSE,FALSE,FALSE,FALSE,0,FALSE,FALSE,FALSE,,
what is the highest elevation of massachusetts?,FALSE,FALSE,FALSE,FALSE,0,FALSE,FALSE,FALSE,,
what religion was dany thomas?,FALSE,FALSE,FALSE,FALSE,0,FALSE,FALSE,FALSE,,
what day did albert namatjira die?,FALSE,FALSE,FALSE,FALSE,0,FALSE,FALSE,FALSE,,
what are the school colors of miami university?,FALSE,FALSE,FALSE,FALSE,0,FALSE,FALSE,FALSE,,
when did arkansas becomes the twenty-fifth state?,FALSE,FALSE,FALSE,FALSE,0,FALSE,FALSE,FALSE,,
who was the dominican republic first president?,FALSE,FALSE,FALSE,FALSE,0,FALSE,FALSE,FALSE,,
when did london become the uk capital?,FALSE,FALSE,FALSE,FALSE,0,FALSE,FALSE,FALSE,,
what was the occupation of gandhi?,FALSE,FALSE,FALSE,FALSE,0,FALSE,FALSE,FALSE,,
who is frank lucas son mother?,FALSE,FALSE,FALSE,FALSE,0,FALSE,FALSE,FALSE,,
who was the first vice president of india?,FALSE,FALSE,FALSE,FALSE,0,FALSE,FALSE,FALSE,,
who won heisman award the years peyton manning was nominated?,FALSE,FALSE,FALSE,FALSE,0,FALSE,FALSE,FALSE,,
when did francis marion die?,FALSE,FALSE,FALSE,FALSE,0,FALSE,FALSE,FALSE,,
who did john quincy adams run against fro the presidency?,FALSE,FALSE,FALSE,FALSE,0,FALSE,FALSE,FALSE,,
what country is fred perry's headquarters?,FALSE,FALSE,FALSE,FALSE,0,FALSE,FALSE,FALSE,,
what is the name of the airport in sydney australia?,FALSE,FALSE,FALSE,FALSE,0,FALSE,FALSE,FALSE,,
what is between germany and spain?,FALSE,FALSE,FALSE,FALSE,0,FALSE,FALSE,FALSE,,
what is the name of jennifer nettles boyfriend?,FALSE,FALSE,FALSE,FALSE,0,FALSE,FALSE,FALSE,,
what is the post code of ibadan in oyo state of nigeria?,FALSE,FALSE,FALSE,FALSE,0,FALSE,FALSE,FALSE,,
when did napoleon become dead?,FALSE,FALSE,FALSE,FALSE,0,FALSE,FALSE,FALSE,,
when was george bernard born?,FALSE,FALSE,FALSE,FALSE,0,FALSE,FALSE,FALSE,,
who is adobe ceo?,FALSE,FALSE,FALSE,FALSE,0,FALSE,FALSE,FALSE,,
what landform is made up of finland norway and sweden?,FALSE,FALSE,FALSE,FALSE,0,FALSE,FALSE,FALSE,,
where was hinduism begin?,FALSE,FALSE,FALSE,FALSE,0,FALSE,FALSE,FALSE,,
first beatles album in us?,FALSE,FALSE,FALSE,FALSE,0,FALSE,FALSE,FALSE,,
what has the longest wavelengths the lowest frequencies and the lowest energies?,FALSE,FALSE,FALSE,FALSE,0,FALSE,FALSE,FALSE,,
schools clara barton attend during her childhood?,FALSE,FALSE,FALSE,FALSE,0,FALSE,FALSE,FALSE,,
what was the field called where vincent van gogh died?,FALSE,FALSE,FALSE,FALSE,0,TRUE,FALSE,FALSE,,
what is the latitude and latitude of port albany?,FALSE,FALSE,FALSE,FALSE,0,FALSE,FALSE,FALSE,,
what is the total population of timbuktu today?,FALSE,FALSE,FALSE,FALSE,0,FALSE,FALSE,FALSE,,
which austalian city is most populous?,FALSE,FALSE,FALSE,FALSE,0,FALSE,FALSE,FALSE,,
what is the highest point in france?,FALSE,FALSE,FALSE,FALSE,0,FALSE,FALSE,FALSE,,
what are finlands largest rivers?,FALSE,FALSE,FALSE,FALSE,0,FALSE,FALSE,FALSE,,
what us presidents spoke at national ffa conventions?,FALSE,FALSE,FALSE,FALSE,0,FALSE,FALSE,FALSE,,
what was the year that gunsmoke was first broadcasted?,FALSE,FALSE,FALSE,FALSE,0,FALSE,FALSE,FALSE,,
what public company has the most employees in the world?,FALSE,FALSE,FALSE,FALSE,0,FALSE,FALSE,FALSE,,
what country is switzerland next to?,FALSE,FALSE,FALSE,FALSE,0,FALSE,FALSE,FALSE,,
when did william webb ellis die?,FALSE,FALSE,FALSE,FALSE,0,FALSE,FALSE,FALSE,,
what was george h w bush's education?,FALSE,FALSE,FALSE,FALSE,0,FALSE,FALSE,FALSE,,
what is the capital of new york before albani?,FALSE,FALSE,FALSE,FALSE,0,FALSE,FALSE,FALSE,,
what president was in office when veterans day became a holiday?,FALSE,FALSE,FALSE,FALSE,0,FALSE,FALSE,FALSE,,
what are the 7 albums michael jackson sung?,FALSE,FALSE,FALSE,FALSE,0,FALSE,FALSE,FALSE,,
what was the name of the ship hudson was on when he discovered hudson bay?,FALSE,FALSE,FALSE,FALSE,0,FALSE,FALSE,FALSE,,
what is the population of north las vegas nevada?,FALSE,FALSE,FALSE,FALSE,0,FALSE,FALSE,FALSE,,
what band did steve winwood sing for?,FALSE,FALSE,FALSE,FALSE,0,FALSE,FALSE,FALSE,,
what movie did bryan singer direct patrick stewart and halle berry?,FALSE,FALSE,FALSE,FALSE,0,FALSE,FALSE,FALSE,,
who plays ben in dani's house?,FALSE,FALSE,FALSE,FALSE,0,FALSE,FALSE,FALSE,,
who is the president of south africa?,FALSE,FALSE,FALSE,FALSE,0,FALSE,FALSE,FALSE,,
what is the name of the bay on the spainsh north coast?,FALSE,FALSE,FALSE,FALSE,0,FALSE,FALSE,FALSE,,
which country is in both asia and africa?,FALSE,FALSE,FALSE,FALSE,0,FALSE,FALSE,FALSE,,
what are the heaviest organs in the human body?,FALSE,FALSE,FALSE,FALSE,0,FALSE,FALSE,FALSE,,